{
  "schema_version": "0.1",
  "tool": { "name": "cspx", "version": "0.1.0", "git_sha": "UNKNOWN" },
  "invocation": {
    "command": "check",
    "args": ["tests/cases/ok.cspm"],
    "format": "json",
    "timeout_ms": null,
    "memory_mb": null,
    "parallel": 1,
    "deterministic": false,
    "seed": 0
  },
  "inputs": [
    { "path": "tests/cases/ok.cspm", "sha256": "2af183be253fd571e13dd3d310357f3a1ccc7b18502a83ed918e0b88a1e5355f" }
  ],
  "status": "fail",
  "exit_code": 1,
  "started_at": "1970-01-01T00:00:00Z",
  "finished_at": "1970-01-01T00:00:00Z",
  "duration_ms": 0,
  "checks": [
    {
      "name": "check",
      "model": null,
      "target": "deadlock free",
      "status": "fail",
      "counterexample": {
        "type": "trace",
        "events": [],
        "is_minimized": false,
        "tags": ["deadlock"],
        "source_spans": [
          { "path": "tests/cases/ok.cspm", "start_line": 1, "start_col": 1, "end_line": 1, "end_col": 4 }
        ]
      },
      "stats": { "states": 1, "transitions": 0 }
    }
  ]
}
