{
  "schema_version": "0.1",
  "tool": {
    "name": "cspx",
    "version": "0.1.0",
    "git_sha": "UNKNOWN"
  },
  "invocation": {
    "command": "refine",
    "args": [
      "tests/cases/spec.cspm",
      "tests/cases/impl.cspm"
    ],
    "format": "json",
    "timeout_ms": null,
    "memory_mb": null,
    "parallel": 1,
    "deterministic": false,
    "seed": 0
  },
  "inputs": [
    {
      "path": "tests/cases/spec.cspm",
      "sha256": "f447ac88848e64febdf8544ef74cfc11c6c94eb0a1d9a4e9915328fb1cdc5826"
    },
    {
      "path": "tests/cases/impl.cspm",
      "sha256": "e57e3fed2d9bc7d412faca472294bdef577f78dec0e33af5c2a1fb2dc385a557"
    }
  ],
  "status": "pass",
  "exit_code": 0,
  "started_at": "2026-02-07T09:13:00Z",
  "finished_at": "2026-02-07T09:13:00Z",
  "duration_ms": 0,
  "checks": [
    {
      "name": "refine",
      "model": "FD",
      "target": "tests/cases/spec.cspm tests/cases/impl.cspm",
      "status": "pass",
      "counterexample": null,
      "stats": {
        "states": 1,
        "transitions": 0
      }
    }
  ],
  "metrics": {
    "states": 1,
    "transitions": 0,
    "wall_time_ms": 0,
    "cpu_time_ms": null,
    "peak_rss_bytes": null,
    "disk_bytes": null,
    "states_per_sec": null,
    "transitions_per_sec": null,
    "parallelism": {
      "threads": 1,
      "deterministic": false,
      "seed": 0
    }
  }
}
