{
  "schema_version": "0.1",
  "tool": {
    "name": "cspx",
    "version": "0.1.0",
    "git_sha": "UNKNOWN"
  },
  "invocation": {
    "command": "typecheck",
    "args": [
      "tests/cases/ok.cspm"
    ],
    "format": "json",
    "timeout_ms": null,
    "memory_mb": null,
    "parallel": 1,
    "deterministic": false,
    "seed": 0
  },
  "inputs": [
    {
      "path": "tests/cases/ok.cspm",
      "sha256": "2af183be253fd571e13dd3d310357f3a1ccc7b18502a83ed918e0b88a1e5355f"
    }
  ],
  "status": "pass",
  "exit_code": 0,
  "started_at": "2026-02-07T09:13:00Z",
  "finished_at": "2026-02-07T09:13:00Z",
  "duration_ms": 0,
  "checks": [
    {
      "name": "typecheck",
      "model": null,
      "target": null,
      "status": "pass",
      "counterexample": null,
      "stats": {
        "states": 1,
        "transitions": 0
      }
    }
  ],
  "metrics": {
    "states": 1,
    "transitions": 0,
    "wall_time_ms": 0,
    "cpu_time_ms": null,
    "peak_rss_bytes": null,
    "disk_bytes": null,
    "states_per_sec": null,
    "transitions_per_sec": null,
    "parallelism": {
      "threads": 1,
      "deterministic": false,
      "seed": 0
    }
  }
}
